VALUE	SUBSTRATE	BRENDA	INCHI	TEMP	PH	MUTATION	NOTES
0.005	tRNASer	115541	RZYDVXFSYYZQDD-FIVCZYLNSA-N	37	7.5	X	mutant enzyme DELTAG75-N97/DELTAG254-N261, at pH 7.5 and 37C
0.025	tRNASer	115541	RZYDVXFSYYZQDD-FIVCZYLNSA-N	37	7.5	X	mutant enzyme DELTAG75-N97, at pH 7.5 and 37C
0.062	tRNASer	115541	RZYDVXFSYYZQDD-FIVCZYLNSA-N	37	7.6		pH 7.6, 37C
0.2	tRNASer	115541	RZYDVXFSYYZQDD-FIVCZYLNSA-N	37	7.5	X	mutant enzyme DELTAG254-N261, at pH 7.5 and 37C
0.43	tRNASer	115541	RZYDVXFSYYZQDD-FIVCZYLNSA-N	37	7.5		wild type enzyme, at pH 7.5 and 37C
